{
  "schema_version": 1,
  "kind": "CohortEvaluation",
  "batch_id": "example",
  "created_at": "2026-01-15T09:30:00.000Z",
  "denominators": {
    "primary_assignment_count": 1,
    "activated_replacement_count": 1,
    "operational_assignment_count": 1,
    "launched_trial_count": 1,
    "not_started_count": 1,
    "participant_control_started_count": 1,
    "primary_agent_outcome_count": 1,
    "api_behavior_count": 1,
    "task_evaluation_count": 1,
    "report_agreement_count": 1,
    "usage_observed_count": 1,
    "valid_evaluation_count": 1
  },
  "dispositions": {},
  "evidence_integrity": {
    "intact": 1,
    "corrupt": 1,
    "missing": 1
  },
  "censor_classes": {
    "none": 1,
    "pre_control_nonparticipant": 1,
    "administrative_censor": 1,
    "instrumentation_censor": 1
  },
  "task_outcomes": {
    "passed": 1,
    "failed": 1,
    "partial": 1,
    "indeterminate": 1,
    "not_evaluated": 1
  },
  "checks": [
    {
      "id": "example",
      "passed": 1,
      "failed": 1,
      "error": 1,
      "skipped": 1,
      "numerator": 1,
      "denominator": 1
    }
  ],
  "signals": [
    {
      "id": "example",
      "true_count": 1,
      "false_count": 1
    }
  ],
  "per_run": [
    {
      "run_id": "example",
      "status": "passed",
      "score": null,
      "disposition": "completed",
      "evidence_integrity": "intact"
    }
  ],
  "warnings": ["example"],
  "extensions": {}
}
